{
  "schema_version": "sklegal-official-drafting-style-profiles-v1",
  "batch": {
    "run_id": "2026-08-21-official-government-style-manuals",
    "normalized_root": "reference/intake/2026-08-21-official-government-style-manuals/",
    "source_count": 14
  },
  "semantic_provenance": {
    "engine": "local Qwen3.8",
    "model": "qwen3.8-27b-huihui-abliterated-q4_k_m",
    "run_id": "2026-08-21-official-government-style-manuals",
    "provenance_file": "reference/intake/2026-08-21-official-government-style-manuals/qwen/source-routing.provenance.json",
    "prompt_sha256": "e319c4d27055b8335966af7cf79e2a749334021d15a2619d7d58e95926a0370c",
    "output_sha256": "33ee16196be5b47913b756fde3dc8d58c2532da99199512448d2b58f9b6bca83"
  },
  "review_status": "human_review_required",
  "sources": [
    {
      "source_id": "GPO-2016",
      "issuing_body": "U.S. Government Publishing Office",
      "version": "31st edition, 2016",
      "scope": "general federal publication and printing",
      "normalized_path": "reference/intake/2026-08-21-official-government-style-manuals/documents/gpo-style-manual-2016-pdf.md",
      "source_sha256": "da9de9500079e885f54dc8dfe63f62ebbaa3535ce6398333fafbed46f5ce512f",
      "currentness": "current official edition"
    },
    {
      "source_id": "HOLC-STYLE-2022",
      "issuing_body": "House Office of Legislative Counsel",
      "version": "December 2022",
      "scope": "House legislative drafting",
      "normalized_path": "reference/intake/2026-08-21-official-government-style-manuals/documents/house-manual-on-drafting-style-2022-pdf.md",
      "source_sha256": "7e68eb1c2b6c2a3230ca46b48976557afde2c488ee756cf3a3bbfed7624dbafa",
      "currentness": "current"
    },
    {
      "source_id": "HOLC-INTRO-2025",
      "issuing_body": "House Office of Legislative Counsel",
      "version": "revised January 13, 2025",
      "scope": "overview of federal legislative drafting",
      "normalized_path": "reference/intake/2026-08-21-official-government-style-manuals/documents/house-introduction-to-legislative-drafting-2025-pdf.md",
      "source_sha256": "6bea8ff0940b0c0f76810fe8dfc62e0e17a985f608866fb409e8b451f6155841",
      "currentness": "current"
    },
    {
      "source_id": "OFR-DDH-2018-R2.2",
      "issuing_body": "Office of the Federal Register",
      "version": "August 2018, revision 2.2 June 2025",
      "scope": "Federal Register rules, proposed rules, notices",
      "normalized_path": "reference/intake/2026-08-21-official-government-style-manuals/documents/ofr-document-drafting-handbook-2018-r2-2-pdf.md",
      "source_sha256": "23228934343294b0cd9785703bf287a86258ec716ecd62d9332ee09cb695ebc6",
      "currentness": "current revision"
    },
    {
      "source_id": "OFR-IBR-2023",
      "issuing_body": "Office of the Federal Register",
      "version": "June 2023, revision August 28, 2023",
      "scope": "incorporation by reference in the Code of Federal Regulations",
      "normalized_path": "reference/intake/2026-08-21-official-government-style-manuals/documents/ofr-incorporation-by-reference-handbook-2023-pdf.md",
      "source_sha256": "42f4d8dff64dea49152d3f54aa104febabc2c511e603898b800e687a9c7a53cd",
      "currentness": "currentness stated in routing"
    },
    {
      "source_id": "NARA-STYLE-2024",
      "issuing_body": "National Archives and Records Administration",
      "version": "updated December 9, 2024",
      "scope": "NARA communications and usage",
      "normalized_path": "reference/intake/2026-08-21-official-government-style-manuals/documents/nara-writing-style-guide-2024-pdf.md",
      "source_sha256": "5dc307a30e56435a1231690f6889660d544c70fa75ddb0418ed3cd324d914e46",
      "currentness": "current"
    },
    {
      "source_id": "EIA-STYLE-2020",
      "issuing_body": "Energy Information Administration",
      "version": "December 2020",
      "scope": "EIA external analytical communications",
      "normalized_path": "reference/intake/2026-08-21-official-government-style-manuals/documents/eia-writing-style-guide-2020-pdf.md",
      "source_sha256": "6d89adec71d4f02d07dba1579bde2df0278cde1fd0b64b9aea9fb27b956ff635",
      "currentness": "currentness review required"
    },
    {
      "source_id": "DOE-TECH-STYLE-2015",
      "issuing_body": "Department of Energy Technical Standards Program",
      "version": "May 2015",
      "scope": "DOE standards, handbooks, and specifications",
      "normalized_path": "reference/intake/2026-08-21-official-government-style-manuals/documents/doe-technical-standards-style-guidance-2015-pdf.md",
      "source_sha256": "3bbbd7c89f3cf0b67355f04385d6eac1d7d8f4f837f963f16f22e89ead007d0f",
      "currentness": "current official posting"
    },
    {
      "source_id": "NIJ-STYLE-2022",
      "issuing_body": "National Institute of Justice",
      "version": "2022 identifier, evidence updated February 2025",
      "scope": "NIJ publications and web writing",
      "normalized_path": "reference/intake/2026-08-21-official-government-style-manuals/documents/nij-style-guide-2022-pdf.md",
      "source_sha256": "866c9200bb0edee1b2554c698ad691c251e6940c06ffac374425b72e39db08b1",
      "currentness": "currentness discrepancy requires review"
    },
    {
      "source_id": "DOI-CORR-2014",
      "issuing_body": "Department of the Interior",
      "version": "October 22, 2014",
      "scope": "DOI secretarial correspondence",
      "normalized_path": "reference/intake/2026-08-21-official-government-style-manuals/documents/doi-secretarial-correspondence-handbook-2014-pdf.md",
      "source_sha256": "b35625ceaf8517eb09d4c74e1dc66a01b94e359afbedcb1c52aa1eb8ba624f68",
      "currentness": "currentness review required"
    },
    {
      "source_id": "USCG-CORR-2024",
      "issuing_body": "U.S. Coast Guard",
      "version": "February 2024",
      "scope": "USCG electronic and paper correspondence",
      "normalized_path": "reference/intake/2026-08-21-official-government-style-manuals/documents/uscg-correspondence-manual-2024-pdf.md",
      "source_sha256": "2410e971aebf6de25071b71b6b76668a62bbacb8da6d304db5e5519b77ace7c0",
      "currentness": "current; cancels COMDTINST M5216.4D"
    },
    {
      "source_id": "CA7-TYPOGRAPHY",
      "issuing_body": "U.S. Court of Appeals for the Seventh Circuit",
      "version": "2020 edition",
      "scope": "Seventh Circuit briefs and other papers",
      "normalized_path": "reference/intake/2026-08-21-official-government-style-manuals/documents/seventh-circuit-practitioners-handbook-pdf.md",
      "source_sha256": "495bc24c2cc417b98355f42543a6d20549476cdf322b3e8e621d9bce901024ce",
      "currentness": "currentness review required"
    },
    {
      "source_id": "EPA-STYLE-2009",
      "issuing_body": "Environmental Protection Agency",
      "version": "January 2009",
      "scope": "EPA communications, design, accessibility, and production",
      "normalized_path": "reference/intake/2026-08-21-official-government-style-manuals/documents/epa-communication-product-standards-stylebook-2009-pdf.md",
      "source_sha256": "8cfa2453421751d1c9c6a5f60c56dccc00c283d411bd51d33b9e28bc7f748df4",
      "currentness": "archived; supersession unknown"
    },
    {
      "source_id": "WH-CORR-HIST",
      "issuing_body": "White House, Ford Administration",
      "version": "1975",
      "scope": "historical executive correspondence",
      "normalized_path": "reference/intake/2026-08-21-official-government-style-manuals/documents/white-house-correspondence-manual-historical-ford-pdf.md",
      "source_sha256": "da509600d3c650c9ea747a1d2e1d48e935d8e638b4cdf111381302cc5346228b",
      "currentness": "historical; never current"
    }
  ],
  "rules": [
    {
      "rule_id": "SPR-001",
      "category": "core_principles",
      "rule_text": "Use the most specific guide for the document's issuing body and declared scope; retain the general federal baseline outside that scope.",
      "modality": "should",
      "scope": "federal drafting profile selection",
      "exceptions": [
        "Agency or court-specific guidance controls within its declared scope."
      ],
      "uncertainty": "Routing is based on the supplied Qwen3.8 evidence excerpts; full rule text requires review.",
      "contradictions": [
        "GPO-2016 baseline versus agency supplements is a preserved routing conflict."
      ],
      "supersession": {
        "status": "none_identified",
        "details": "No general supersession inferred."
      },
      "review_status": "human_review_required",
      "source": {
        "source_id": "GPO-2016",
        "issuing_body": "U.S. Government Publishing Office",
        "version": "31st edition, 2016",
        "source_sha256": "da9de9500079e885f54dc8dfe63f62ebbaa3535ce6398333fafbed46f5ce512f",
        "locator": {
          "normalized_path": "reference/intake/2026-08-21-official-government-style-manuals/qwen/source-routing.md",
          "line_start": 1,
          "line_end": 25,
          "anchor": "batch scope and source routing table"
        }
      },
      "semantic_provenance": {
        "engine": "local Qwen3.8",
        "model": "qwen3.8-27b-huihui-abliterated-q4_k_m",
        "run_id": "2026-08-21-official-government-style-manuals",
        "provenance_file": "reference/intake/2026-08-21-official-government-style-manuals/qwen/source-routing.provenance.json",
        "prompt_sha256": "e319c4d27055b8335966af7cf79e2a749334021d15a2619d7d58e95926a0370c",
        "output_sha256": "33ee16196be5b47913b756fde3dc8d58c2532da99199512448d2b58f9b6bca83"
      },
      "authority_boundary": "typed_style_proposal_only; no workflow authority, approval, or external-action authorization"
    },
    {
      "rule_id": "SPR-002",
      "category": "document_settings",
      "rule_text": "For DOE technical standards, use the prescribed document hierarchy, cover material, numbering, and section structure; do not transfer it to unrelated scopes.",
      "modality": "should",